{
  "$schema":"https://json-schema.org/draft/2020-12/schema",
  "$id":"https://rocksoul.dev/jizz/schemas/discovery-candidate.schema.json",
  "title":"JIZZ Discovery Candidate",
  "x-jizz-schema-version":"jizz.candidate.v0.1",
  "type":"object",
  "additionalProperties":false,
  "required":["schema_version","candidate_id","domain","title","candidate_type","zone_hint","discovery","sources","duplicate_check","status","notes"],
  "properties":{
    "schema_version":{"const":"jizz.candidate.v0.1"},
    "candidate_id":{"type":"string","pattern":"^CAND-JIZZ-[A-Z0-9-]+$"},
    "domain":{"const":"PERSPECTIVE"},
    "title":{"type":"string","minLength":1},
    "candidate_type":{"type":"string","minLength":1},
    "zone_hint":{"enum":["GLOBAL","REGIONAL","LOCAL","DIGITAL","CULTURAL","TECHNICAL","POLITICAL","ECONOMIC","SCIENTIFIC","COMMUNITY"]},
    "discovery":{"type":"object","additionalProperties":false,"required":["summary","why_relevant","discovered_at","search_terms","lane_id"],"properties":{"summary":{"type":"string","minLength":1},"why_relevant":{"type":"string","minLength":1},"discovered_at":{"type":"string","format":"date-time"},"search_terms":{"type":"array","items":{"type":"string"}},"lane_id":{"type":"string","minLength":1}}},
    "lineage":{"type":"object","additionalProperties":false,"required":["research_issue_number","research_issue_url","research_fingerprint","origin"],"properties":{"research_issue_number":{"type":"integer","minimum":1},"research_issue_url":{"type":"string","format":"uri"},"research_fingerprint":{"type":"string","minLength":1},"origin":{"type":"string","minLength":1}}},
    "inspection":{"type":"object","additionalProperties":false,"required":["explicit","recorded_at","scope","uncertainty"],"properties":{"explicit":{"const":true},"recorded_at":{"type":"string","format":"date-time"},"scope":{"type":"string","minLength":1},"uncertainty":{"type":"string","minLength":1}}},
    "sources":{"type":"array","minItems":1,"items":{"type":"object","additionalProperties":false,"required":["title","locator","source_type","authority","publisher","country","language","published_at"],"properties":{"title":{"type":"string","minLength":1},"locator":{"type":"string","format":"uri"},"source_type":{"enum":["news_metadata","institutional_web","academic_publication","community_source","government_publication","legal_record","broadcast_archive","other"]},"authority":{"enum":["discovery_only","source_inspected"]},"publisher":{"type":["string","null"]},"country":{"type":["string","null"]},"language":{"type":["string","null"]},"published_at":{"type":["string","null"],"format":"date-time"}}}},
    "duplicate_check":{"type":"object","additionalProperties":false,"required":["checked","possible_matches"],"properties":{"checked":{"type":"boolean"},"possible_matches":{"type":"array","items":{"type":"string"}}}},
    "status":{"enum":["discovered","triaged","needs_sources","source_inspected","ready_for_observation","canonicalized","merged","rejected"]},
    "notes":{"type":["string","null"]}
  }
}
