{
  "schema_version":"jizz.candidate.v0.1",
  "candidate_id":"CAND-JIZZ-KALEVALA-HERITAGE-IDENTITY-FRAMING-AB2A63AF",
  "domain":"PERSPECTIVE",
  "title":"Kalevala heritage and identity framing",
  "candidate_type":"cultural heritage / identity perspective",
  "zone_hint":"CULTURAL",
  "discovery":{"summary":"Source-inspected PERSPECTIVE work for Kalevala heritage and identity framing.","why_relevant":"Issue #42 completed source-scoped canonicalization.","discovered_at":"2026-09-11T01:00:28Z","search_terms":["Kalevala heritage identity framing"],"lane_id":"cultural-heritage-discourse"},
  "lineage":{"research_issue_number":42,"research_issue_url":"https://github.com/bjo163/rocksoul-jizz/issues/42","research_fingerprint":"ab2a63af2a83b073","origin":"jizz-steward"},
  "inspection":{"explicit":true,"recorded_at":"2026-09-11T23:42:13Z","scope":"Three inspected publisher-distinct sources were used for narrow canonical records.","uncertainty":"Publisher diversity is not consensus. Community coverage remains incomplete."},
  "sources":[
    {"title":"Kalevala in White Sea Karelian","locator":"https://www.karjalansivistysseura.fi/kalevala-vienankarjalaksi/","source_type":"institutional_web","authority":"source_inspected","publisher":"Karjalan Sivistysseura","country":"Finland","language":"Finnish / White Sea Karelian","published_at":"2015-02-25T00:00:00Z"},
    {"title":"Kalevala Living Epic European Heritage Label","locator":"https://www.museovirasto.fi/en/articles/kalevala-elava-eepos-sai-euroopan-kulttuuriperintotunnuksen","source_type":"institutional_web","authority":"source_inspected","publisher":"Finnish Heritage Agency","country":"Finland","language":"English","published_at":"2024-04-11T00:00:00Z"},
    {"title":"European Heritage Label for Kalevala","locator":"https://www.finlit.fi/en/latest-news/news/the-european-commission-has-awarded-the-kalevala-with-the-european-heritage-label/","source_type":"institutional_web","authority":"source_inspected","publisher":"Finnish Literature Society","country":"Finland","language":"English","published_at":"2024-04-11T00:00:00Z"}
  ],
  "duplicate_check":{"checked":true,"possible_matches":[]},
  "status":"merged",
  "notes":"Merged into data/live/kalevala-heritage-identity-framing.json with parent issue #42 retained. canonical_edge_created=false."
}